{
  "id": "bad-gate-no-external-check",
  "title": "A gate claimed externally verifiable but with no external check",
  "kind": "gate",
  "statement": "No deployment above the named threshold.",
  "committed_at": "2026-02-01",
  "last_reviewed_at": "2026-10-01",
  "externally_verifiable": true,
  "trigger": {"metric": "example-biosec-uplift-benchmark-v1", "threshold": 0.08, "measurable": true},
  "enforcer": {"kind": "independent-reviewer", "named": "Example External Review Panel"},
  "dependencies": [{"kind": "benchmark", "statement": "the benchmark remains valid"}]
}
